{
  "wp_id": "WP-0007",
  "title": "Process Equipment High Complexity CQV Package",
  "scope": "FETTE F10i tablet compression machine OEB4 containment",
  "wp_type": "PROCESS_EQUIPMENT",
  "complexity": "HIGH",
  "lifecycle_state": "WP_DRAFT",
  "owner_function": "CQV",
  "created_at_utc": "2026-06-12T00:00:00Z",
  "updated_at_utc": "2026-06-12T00:00:00Z",
  "preset_ref": {"preset_id": "PS-PE-HIGH", "preset_version": "v1.0.1"},
  "task_pool_ref": {"task_pool_id": "TP-PE-HIGH", "task_pool_version": "v1.0.1"},
  "profile_ref": {"profile_id": "PROF-PE-HIGH", "profile_version": "v1.0.1"},
  "calendar_logic_ref": {"calendar_id": "CAL-WORKWEEK", "calendar_version": "v1.0.1", "canonical_calendar_version": "v1", "timezone": "UTC+02:00"},
  "standards_bundle_ref": {"bundle_id": "BND-CQV-BASE", "bundle_version": "v1.0.1", "status": "TESTING_ONLY", "usage_classification": "PRODUCT_TESTING_ONLY"},
  "provenance_refs": {
    "contract_id": "VALOR-contract-orch-wp",
    "contract_version": "v1.0.1",
    "testing_only_stamp": "PRODUCT TESTING ONLY — NOT APPROVED FOR REAL-LIFE REGULATED CQV/GMP USE."
  },
  "testing_only": true,
  "usage_classification": "PRODUCT_TESTING_ONLY",
  "tasks": []
}
